{"artifacts":{"campaign/context_evidence/README.md":{"bytes":6349,"sha256":"c93bdd98963fdba57df7e2038f16e9f468b44d23cc2f185f1448ce27b0355610"},"campaign/context_evidence/contracts/v1/baseline_seal.schema.json":{"bytes":4007,"sha256":"736e8c80cfeb0a20eea2bf148725aea424ea16684a3f73458b0d4afa326c3736"},"campaign/context_evidence/contracts/v1/campaign_state.schema.json":{"bytes":4903,"sha256":"66555c4b0618861a30f8ef601d6b54a102cd2303e5796dadeb1cac3559052fc2"},"campaign/context_evidence/contracts/v1/case_enrichment.schema.json":{"bytes":2242,"sha256":"b095095df48dc2baf2efcc52d73c9b352dd45758b78e04a470cedfcbb920e06b"},"campaign/context_evidence/contracts/v1/case_review_decision.schema.json":{"bytes":2105,"sha256":"3f42a17be47640c2258005f18f241ffc0c1837efecb6c0deac35cd5432ee61a3"},"campaign/context_evidence/contracts/v1/foundation_receipt.schema.json":{"bytes":2004,"sha256":"ac7f52ec19a9546fc37d1ad5adc7858388d6e875354c9cc0504d4f60e3c97b1b"},"campaign/context_evidence/contracts/v1/known_source_reconciliation.schema.json":{"bytes":3348,"sha256":"08d7b30375569a61f7a22be11459214a4c2701267d0d76e6cb86a14a4c8e0190"},"campaign/context_evidence/contracts/v1/no_gain_policy.schema.json":{"bytes":2018,"sha256":"21be03049c72d2787e1865fd980ec3d760c8ea718429e08e914b93508eea0002"},"campaign/context_evidence/contracts/v1/release_seal.schema.json":{"bytes":9617,"sha256":"335a5d2007d09cf1036890bb9c00beb58ee17ff2800c0f0523cd7e2ff8d9f0b2"},"campaign/context_evidence/contracts/v1/research_queue.schema.json":{"bytes":5750,"sha256":"b2ac4473e27637a9e61a35de1be3dc8dcefd615d45b252805dc1713769e4a073"},"campaign/context_evidence/contracts/v1/source_ledger.schema.json":{"bytes":3611,"sha256":"bd16264bc406e77ae6ac41e8a30cf547b893726f1a83d5f76c4b16b69cb80673"},"campaign/context_evidence/contracts/v1/wave_package.schema.json":{"bytes":2072,"sha256":"e6142f9be331f21959942bcdcc755838befbf4ea3be5e763b4de3dd5909a4425"},"campaign/context_evidence/ledgers/case_enrichment.jsonl":{"bytes":722517,"sha256":"7202a69fa25d5f9c9b7e3f2075f9e7dfde5ffd677e5cdfef75d0cc5def9d9565"},"campaign/context_evidence/ledgers/case_review_decisions.jsonl":{"bytes":1177156,"sha256":"26975960f100372ce0300cfcd04ac345316c3cd33b308354a43a3c0a01f99841"},"campaign/context_evidence/ledgers/research_queue.jsonl":{"bytes":287553,"sha256":"b5d04865ac633cc02db02cdc459172a8d4770a34ed6b8edf841293bc14fa5d3e"},"campaign/context_evidence/ledgers/source_ledger.jsonl":{"bytes":175307,"sha256":"ef71e7594bbb393e5fb4067b8fb7561dbcad01d6ac2a0adc0cb76a0136ddccdd"},"campaign/context_evidence/state/baseline_seal.json":{"bytes":2867,"sha256":"163c08f6f181a864235cd037e0613880d05ddca0769b83fe09899e3e475d1bba"},"campaign/context_evidence/state/current.json":{"bytes":2136,"sha256":"bb3c8c0207a4a015d1fcdc5ed59242c1b0084ea01f1f0a21764a2d034f5af0b0"},"campaign/context_evidence/state/known_source_reconciliation.json":{"bytes":162040,"sha256":"723efed35702c749d52a5f36fdb2841aa6db4dd09a467611a1e5cd31020126d3"},"campaign/context_evidence/state/no_gain_policy.json":{"bytes":728,"sha256":"c8fd149b63bfb439126a79f0ae768cd4f473cca90f98f71f8b779cfe5074fb1c"}},"builder":{"path":"scripts/build_context_evidence_campaign.py","sha256":"4ec2ae698b07f40713f337ee376d3e35d46cd475486c34c08ad8dab37332d0d3"},"campaignId":"context-evidence-expansion-20260810","externalInputs":{"C:\\Users\\jarod\\Documents\\Cattle Mutilation Map\\outputs\\phase1_1\\global_animal_seed_v1_1\\crop_circle_source_access_audit.csv":{"bytes":7477735,"selectedRows":2371,"sha256":"f12fd4bd5dc78f118e1a7fe68b45cd92e5fe63c39e0df08d81da9c41576c73d2"},"C:\\Users\\jarod\\Documents\\Cattle Mutilation Map\\repo_worktree\\docs\\cattle_mutilation\\source_registry.json":{"bytes":13874,"selectedRows":18,"sha256":"f4f82d514173d4ee231b4d4033be40272f16757957362f02b455288a79221282"}},"ledgerCounts":{"assertions":847,"queueItems":184,"reviewDecisions":1694,"sources":144},"packageTreeSha256":"252dd220202b76b867fb514d06419660ee3a4a37746370834c35dfd39b1605c2","result":"valid","schemaId":"ufo-timeline-context-evidence-foundation-receipt-v1.0.0","semanticChecks":["schemas_draft_2020_12_valid","baseline_artifact_hashes_match","ledger_ids_unique_and_references_resolve","field_assertions_have_source_locators_and_frozen_hashes","review_decisions_match_assertion_evidence","reviewer_quorum_and_conflicts_fail_closed","queue_priority_is_deterministic_and_proximity_blind","attempt_fingerprints_are_unique_and_budget_bounded","two_subwave_no_gain_stop_rule_enforced","privacy_forbidden_keys_absent","frozen_known_source_fingerprint_index_verified","non_milestone_release_seal_fail_closed"],"validationEpoch":"2026-08-10T00:00:00Z"}
